26:23:00,"Kuy wax lu neex, tey mébét lu bon,
yaay xaalis bu rax, ñu xoob ca ndabal xandeer."
26:24:00,"Ab noon làqoo na ay waxam,
lal pexey wor ca xolam."
26:25:00,"Buy wax lu neex, bul gëm,
ñaawtéef la xol ba fees dell."
26:26:00,"Su la nëbbalee mbañeel, di la nax it,
ag mbonam mujj bir ñépp."
26:27:00,"Ku gasal nit am yeer, yaa cay daanu;
ku béraŋu doj, ngir tance, yaay tancu."
26:28:00,"Kuy fen, dangaa bañ ka nga fenal,
te boroom làmmiñ wu neex day sànke."
27:01:00,"Bul damoo ëllëg,
ndax xamoo luy xew tey."
27:02:00,"Bul tëggu, bàyyil ñu tagg la,
muy waxi keneen; yaw, bu ko wax."
27:03:00,"Doj diis na, suuf dib sëf,
waaye fitnay dof a ko raw."
27:04:00,"Xadar day ñàng, mer di wal mu baawaan,
waaye fiiraange amul moroom."
27:05:00,"Artu yu ñu la biralal
moo gën cofeel gu la boroom ñooru."
27:06:00,"Soppe, bu lay gaañ sax, wóolu ko.
Nit bañ na la, te di la fóon lu bare."
27:07:00,"Ku suur, bañ lem ju xelli,
waaye boo xiifee, lu wex lu ne neex la."
27:08:00,"Ku sore fa nga bokk,
dangay mel ni picc mu sore tàggam."
27:09:00,"Diwook suuru day naatal xol;
waaye li neex cib xarit, xol la lay digale."
27:10:00,"Bul fàtte sab xarit mbaa sa xaritu baay,
boo jàqee, bul seeti sa mbokk;
dëkkandoo bu jegee gën mbokk mu sore."
27:11:00,"Muusal, doom, ma bég,
ba mana tontu ku ma sikk."
27:12:00,"Kuy foog, gisu ay, làqu;
ab téxét ne ca tëñëx, loru."
27:13:00,"Ku gàddul jàmbur bor, jëlal mbubbam;
tayle ko, moo dige feyal jàmbur."
27:14:00,"Nuyoo bu xumb, suba teel
mooki saagaa yem."
27:15-16,"Jabar ju pànk
mooy senn bu dakkul, cib taw;
ku ko mana yemale,
mana téye ngelaw mbaa nga ŋëb ag diw."
27:17:00,"Weñ ay nàmm weñ,
nit ay nàmm xelu moroom ma."
27:18:00,"Ku aar garab, lekk ca doom ya;
ku toppatoo sa sang, am ngërëm."
27:19:00,"Ku xool cim ndox, gis sa kanam,
nga xool sab xol, gis sa jikko."
27:20:00,"Njaniiw ak biir suuf du fees,
bët it du doylu mukk."
27:21:00,"Xaalis ak wurus sawaraa koy xelli,
waaye àtteb nit ca taggam."
27:22:00,"Soo jëloonub dof, yeb ci gënn,
booleek pepp, wol,
du tax ndof ga deñ."
27:23-24,"Xamal bu baax lu say gàtt nekke,
te def sa xel ci say gétt,
ndax alal wéyul fàww,
ag pal du ñeel sëtoo sët."
27:25-26,"Gannaaw bu ñu gubee,
ba ñax saxaat,
ñu dajale ngooñ ma ca tund ya,
say xar da lay amal koddaay,
bëy yi génneel la njëgu tool."
27:27:00,"Meewum bëy daldi am, ba doy la dund,
yaak sa waa kër
ak sa surga yu jigéen."
28:01:00,"Ku bon daw na te dàqeesu ko,
ku jub ñeme ni gaynde."
28:02:00,"Bu am réew dee fippu, kilifa ya bare;
réew mu jàmm sax, kilifa gaa am déggin ak xam-xam."
28:03:00,"Ku ñàkk, su jekkoo ab ndóol,
du ko bàyyil fepp, day mel ni waame."
28:04:00,"Ku wacc yoon, gërëm ku bon;
ku wormaal yoon, jànkoonteek ku bon."
28:05:00,"Ku bon xamul njub,
kuy wut Aji Sax ji, xam nga njub bu wér."
28:06:00,"Ñàkk te mat
moo gën barele te dëng."
28:07:00,"Gone gu sàmm yoon am nag dégg,
ku ànd ak sagaru nit gàcceel sa baay."
28:08:00,"Kiy leble di tege, ba barele,
kay yéwéne néew-ji-doole lay dencal."
28:09:00,"Soo dee tanqamlu yoon,
sag ñaan sax Yàlla suur na ko."
28:10:00,"Ku yóbbe bàkkaar nit kuy jubal,
yeer ma nga gas, yaa cay tàbbi,
waaye ku mat di jagoo ngëneel."
28:11:00,"Waay a ngi barele, defe ne xelu na;
ku néewle amug dégg, gis ne xeluwul."
28:12:00,"Bu kuy jëfe njekk amee ndam, mbégte mu réy la;
ab soxor falu, ñépp làquji."
28:13:00,"Kuy làq say tooñ doo baaxle,
ku koy nangu, tuub ko, am yërmandey Yàlla."
28:14:00,"Mbégte ñeel na ku saxoo ragal Yàlla,
waaye ku dëgër bopp tàbbi ci njekkar."
28:15:00,"Kilifa guy soxore néew-ji-doole
mook gaynde guy yëmmoo yem, mbaa rab wuy songe."
28:16:00,"Kilifa gu amulug dégg, day foqati rekk,
waaye ku bañ lu lewul, gudd fan."
28:17:00,"Ku bóom nit, daw, ba tàbbi njaniiw;
bu ko kenn taxawu."
28:18:00,"Mat, mucc;
dëng, dàll daanu."
28:19:00,"Beyal sab tool, sab dund doy;
topp ay caaxaan, ndóol ba doyal."
28:20:00,"Boroom worma, bare barke;
ku yàkkamtee woomle, sa mbugal du jaas."
28:21:00,"Par-parloo baaxul,
waaye dogu mburu moyloo na kilifa."
28:22:00,"Ab nay day yàkkamtee barele,
te xamul, ba ko ñàkk di dab."
28:23:00,"Boo artoo nit, mu baaxe la ëllëg;
yaa koy gënal ku ko doon jay."
28:24:00,"Ku xañ say waajur seen alal
te defe ne tooñoo,
yaa neexook saay-saayu yàqkat."
28:25:00,"Ku bëgge day sooke ay,
te ku wóolu Aji Sax ji, woomle."
28:26:00,"Ku doyloo sam xel, dof nga;
ku jëfe xel mu rafet, mucc nga."
28:27:00,"Kuy jox néew-ji-doole, doo ñàkk;
nga gëmm ne gisoo, bare ku la móolu."
28:28:00,"Bu ab soxor faloo, ñépp làquji,
bu daanoo, kuy jëfe njekk teg tànk."
29:01:00,"Ku ñuy artu, nga të ticc,
dangay jekki yàqu, ba wees am paj."
29:02:00,"Kuy jëfe njekk falu, baadoolo bég;
ab soxor jiite, baadoolo binni."
29:03:00,"Kuy jëfe xel, bégal sa baay;
nga ànd aki gànc, yàq alal."
29:04:00,"Buur jub, am réew dëgër;
mu bëggi galag, réew ma sànku."
29:05:00,"Kuy jay sa moroom,
yaa ngi koy dugal."
29:06:00,"Ku bon day moy, ba dugal boppam;
ku jub di woy aka bànneexu."
29:07:00,"Boroom njekk a xam àqu néew-ji-doole,
ab soxor xamu ca dara."
29:08:00,"Ñaawlekat a ngi taal ab dëkk,
ku xelu di giifal mer."
29:09:00,"Boroom xel, buy layookub dof,
bu mereek buy ree, jàmm du am."
29:10:00,"Ab bóomkat day sib ku mat,
di wuta bóom kuy jubal."
29:11:00,"Ab dof day mer, sàmbaar;
ku xelu, mer, ànd ak sagoom."
29:12:00,"Kilifa dégluy fen,
jawriñ yépp di ñu bon."
29:13:00,"Ku ñàkk ak ka ko nennoo bokk lenn,
Aji Sax jee leen boole sàkk."
29:14:00,"Buur àtte way-ñàkk ci dëgg,
ab jalam sax."
29:15:00,"Deel bantal aka yedde, day rafetal xel;
gone goo bay-bayal, mu gàcceel ndeyam."
29:16:00,"Bu ku bon féetee kaw, ag moy law,
waaye kiy jëfe njekk ay fekke jéllam."
29:17:00,"Yaral sa doom, mu noppal la,
bànneexal la."
29:18:00,"Fu Yàlla feeñoowul, nit ña fétteeral,
waaye ku topp yoon, am mbégte."
29:19:00,"Waxi neen yarul surga,
da lay dégg te du la déggal."
29:20:00,"Ana koo gis, mu rattaxle?
Kooku ab dof a ko gën demin."
29:21:00,"Ku yàq sab surga ba muy ndaw,
bu ëllëgee mu defe ne doom la."
29:22:00,"Boroom xadar day sooke ay,
te ku tàng bopp moy, moyati."
29:23:00,"Réy-réylu, detteelu rekk;
woyofal, ñu naw la."
29:24:00,"Ku ànd akub sàcc, sa noonu bopp nga:
soo waxee dëgg, yoon topp la;
soo ko miimee, Yàlla topp la."
29:25:00,"Ragal nit dugal sa bopp la,
ku wóolu Aji Sax ji, fegu."
29:26:00,"Ñu baree ngi sàkku kilifa baaxe leen,
moona Aji Sax jeey àtteb jaam."
29:27:00,"Ku jub day sib ku dëng,
ku bon sib kuy jubal."
30:01:00,"Lii waxi Agur la, góor gay doomu Yake mu Maasaf. Góor ga daa wax ak Itiyel, wax ak Itiyel ak Ukal. Mu ne:"
30:02:00,"Maa dofe dëgg, ba yées ci nit ñi,
dég-dégu nit sax awma ko."
30:03:00,"Jànguma, ba am xel mu rafet,
awma xam-xam ci Aji Sell ji."
30:04:00,"Ana ku yéegoon asamaan, ba wàcc?
Mbaa mu masa ŋëb ngelaw ciy loxoom?
Ana ku masa ëmb ndox ci ndimo?
Mbaa mu rëdd mboolem kemi àddina?
Nu mu tudd ak nu doomam tudd?
Wax ma, yaw mi ko xam!"
30:05:00,"Lu Yàlla wax, mat na sëkk,
mooy yiir ku ko làqoo."
30:06:00,"Bul yokk ay waxam,
mu weddi say fen, nga weeru."
30:7-9,"Éy Yàlla, ñaar laa la ñaan,
ngalla may ma ko sama giiru dund:
caaxaan aki fen, yal na ma sore,
néewleek barele, bu ma ci may lenn,
leel ma lu ma doy;
lu ko moy ma regg, weddi la,
ba naan: «Kuy Aji Sax ji?»
Mbaa ma ñàkk bay sàcc,
di la ñàkke worma, yaw sama Yàlla."
30:10:00,"Bul sikkal ab surga ca njaatigeem,
da lay ñaan-yàlla, mu dal la."
30:11:00,"Ag maas a ngi saaga baay,
te wormaaluñu ndey."
30:12:00,"Ag maas a ngi defe ne set nañu,
te taq ripp ak bàkkaar."
30:13:00,"Ag maas a ngi daŋŋiiral;
aka ñoo mana xeeloo!"
30:14:00,"Ag maas a ngi, seeni sell niy saamar,
seeni gëñ niy paaka,
ñuy lekk néew-ji-doole, ba raafal leen ci réew mi,
ba ku ñàkk jeex ci biir nit ñi."
30:15:00,"Saxu watar du suur, ñaar ñu jigéen la am:
Jox Ma ak Jox Ma."
30:16:00,"Ñett a ngii ñu dul suur,
ba ci ñeent ñu dul ne doy na mukk:
njaniiw,
jigéen ju jaasir,
suuf, du màndi ndox,
sawara, du ne doy na mukk."
30:17:00,"Kuy xeelu sa baay,
di siidee déggal sa ndey,
baaxoñ génne ciw xur, luqi sa bët,
tan ya lekk."
30:18-19,"Ñett a ngii, yéem na ma,
ba ci ñeent yu ma xamul:
yoonu jaxaay ci asamaan,
yoonu jaan ci kawi doj,
yoonu gaal ci diggu géej,
yoon wi góor di jaar as ndaw."
30:20:00,"Jikkoy jigéenu moykat a ngii:
day lekk, wommiku, te naan:
«Defuma dara lu aay!»"
30:21-23,"Ñett a ngii, day yëngal suuf,
ba ci ñeent yu suuf àttanul:
jaam bu falu buur,
dof bu regg,
ndaw su bon su for jëkkër,
jigéen ju wuutu sangam bu jigéen."
30:24-28,"Ñeent a ngii, di lu tuut ci kaw suuf,
te am xel, yaroo xel:
xorondom, néew na doole,
waaye bu jotee, mu denc dundam;
daman, barewul kàttan,
te day dëkk ciy doj;
soccet, amul buur,
teewul ñuy àndandoo, diy gàngoor;
sindax, manees na koo ŋëb,
teewul ma nga biir kër buur."
30:29-31,"Ñett a ngii, ñu jekkum ndaag,
ba ci ñeent ñu jekk doxin:
gaynde, mooy buuru rab yi,
ragalul kenn;
séq daagu, jekk taxawaay;
ab sikket,
ak buur ci biiri dagam."
30:32:00,"Boo sàgganee bay tëggu,
mbaa ngay mébét lu bon,
nanga téye saw làmmiñ."
30:33:00,"Ndax ku ruux soow, am ca dax,
ku wañaar bakkan, mu nàcc,
te lu jógal xol, indiw ay."
31:01:00,"Lii waxi Lemuyel la, buuru Maasai, te ndeyam jàngal ko ko. Mu ne:"
31:02:00,"Ngóor si doom, saa doomi bopp!
Yaa di ñaan gu nangu, doom!"
31:03:00,"Bul jox jigéen ñi sa doole,
bul jox say siddit jigéen ñiy sànk buur."
31:04:00,"Buur moomul di naan biiñ, Lemuyel,
buur moomu ko;
kilifa moomul di sàkku ñoll."
31:05:00,"Lu ko moy mu naan, ba fàtte lu yoon tëral,
xañ néew-ji-doole ju ne àqam."
31:06:00,"Bàyyeel ñoll kuy sànku,
bàyyeel biiñ boroom naqar."
31:07:00,"Bu ñu naanee, fàtte seen néewle,
ba dootuñu fàttaliku seenu tiis."
31:08:00,"Nanga àddul ku amul kàddu,
ku sësul fenn, nga ñoŋal àqam."
31:09:00,"Deel àddu, di àtte njub;
ku ñàkk ak ku néewle, nga sàmm àqam."
31:10:00,"Jeeg bu jàmbaare, ndaw lu jafe,
ba rawati gànjar!"
31:11:00,"Jëkkër ja da koy wóolu,
te jëkkër ja day am xéewal, du ko ñàkk."
31:12:00,"Day defal jëkkëram lu baax, du ko lor,
te di ànd ak bakkan."
31:13:00,"Day wut kawari gàtt aki wëñ,
di ca liggéeye mbégte."
31:14:00,"Day mel ni gaalu jula,
di jëli dundam fu sore."
31:15:00,"Day jóg te bët setul,
di waajal njëlu njabootam,
aka sas ay janqam."
31:16:00,"Day seetlu ab tool, jënd ko,
sàkk ciw ñaqam, jëmbat tóokër."
31:17:00,"Day gañu di góor-góorlu
aka dëgëral përëg ya."
31:18:00,"Day gis njartel liggéeyam,
te làmpam du fey guddi."
31:19:00,"Ma ngay yor poqe
ak këccu, di ëcc."
31:20:00,"Day jox ku ñàkk,
di sàkkal néew-ji-doole."
31:21:00,"Tiitul ci njaboot gi sedd bu metti,
ndax ñoom ñépp ay tegley yére."
31:22:00,"Mooy sàkkal boppam ay malaan,
ay yéreem mucc ayib te yànj."
31:23:00,"Dees na ràññee jëkkëram ca pénc ma,
fa muy toog ca magi réew ma."
31:24:00,"Ndaw su ni mel day ràbb ay yére, di jaay,
aki gañaay, di jox jaaykat yi."
31:25:00,"Faaydaak jom la làmboo,
te ëllëg ubul boppam."
31:26:00,"Day wax lu xelu,
di digle ngor."
31:27:00,"Jigéen jooju mooy bàyyi xel ci njabootam,
te du nangoo yàccaaral."
31:28:00,Doom ya dañu ko naan: «Jarawlakk!»
31:29:00,"Jëkkër ja di ko gërëm naan:
«Jeeg bu jàmbaare bare na,
waaye yaw, yaa ci raw.»"
31:30:00,"Melokaan wu jekk day naxe, taar day wéy,
waaye jigéen ju ragal Aji Sax ji,
kookoo jara gërëm."
31:31:00,"Joxleen ko njukkalu ñaqam,
jëfam di woyam ca pénc ma."